name,abn,donated,donation_count,parties,contract_value,contract_count,contract_per_donation_dollar,sector,state,is_community_controlled
"City of Sydney Council","22636550790","82224","10","Australian Labor Party (N.S.W. Branch); Liberal Party of Australia, NSW Division","2259815","19","27","","NSW","false"
"Rowland Pty Ltd","59011033364","82080","12","Australian Labor Party (State of Queensland); Forward Brisbane Leadership","272736","10","3","","QLD","false"
"The Trustee for Designer Life (Queensland) Trust","13976018396","82000","6","Australian Labor Party (ALP)","9474955","5","116","","QLD","false"
"The Trustee For The Qld Construction Industry Skill Centre Fund","66673126160","81390","2","Construction, Forestry, Maritime Employees Union","15224","1","0","Education","QLD","false"
"Apple Pty Ltd","46002510054","80822","6","AEU NSW Teachers Federation; Country Liberal Party (NT); Laneway Assets Pty Ltd as Trustee for the National Policy Forum Trust","4968424","52","61","Retail","","false"
"APPLIED SATELLITE TECHNOLOGY AUSTRALIA PTY LTD","33065247412","80800","8","Australian Democrats; Australian Labor Party (ALP); Liberal Party (W.A. Division) Inc; Liberal Party of Australia","12706913","43","157","","WA","false"
"FINDEX (AUST) PTY LTD (84 006 466 351)","84006466351","80450","23","Australian Labor Party (N.S.W. Branch); Australian Labor Party (N.S.W. Branch) - NSW; Liberal Party of Australia, NSW Division; Liberal Party of Australia, NSW Division - NSW; Media Entertainment & Arts Alliance; National Party of Australia - N.S.W. - NSW","1374598","25","17","Finance","VIC","false"
"Ally Group Pty Ltd","11064699029","80000","8","Australian Labor Party (ALP)","3028681","9","38","","ACT","false"
"NICHOLAS ARONEY","12618932883","80000","4","Liberal Party of Australia, NSW Division","11000","1","0","","QLD","false"
"COLAS NEW SOUTH WALES PTY LTD","16064662148","80000","6","Liberal Party of Australia (Victorian Division)","12100000","4","151","construction","NSW","false"
"BN Law Ltd","22621026864","80000","2","Construction, Forestry, Maritime Employees Union","103098","3","1","","QLD","false"
"The Trustee for","37034238048","80000","4","Advance Australia; Liberal National Party of Queensland","117129","5","1","","NSW","false"
"BIC SERVICES PTY LTD","40003700301","80000","2","United Workers Union","651046","7","8","","NSW","false"
"ROBERT BIRD GROUP PTY LTD (67 010 580 248)","67010580248","80000","4","Liberal Party of Australia, NSW Division","4874074","10","61","Construction","QLD","false"
"Trivett Automotive Retail Pty Ltd","94000806904","80000","4","AEU NSW Teachers Federation; Australian Education Union","94980","2","1","","NSW","false"
"ROBERTS LIMITED (12 009 475 647)","12009475647","79689","3","Liberal Party of Australia - Tasmanian Division; Liberal Party of Australia LIB - TAS","332212","2","4","Agriculture","TAS","false"
"Coorong Investments Pty Ltd","38007559293","79000","11","Australian Labor Party (Northern Territory) Branch; Australian Labor Party (Northern Territory) Branch - NT; Country Liberal Party (NT); Northern Territory Country Liberal Party - NATIONAL","8852191","1","112","","SA","false"
"Windlab Limited","26104461958","78580","22","Australian Labor Party (ALP); Australian Labor Party (State of Queensland)","17633","1","0","","NSW","false"
"JAMES MARTIN","54401481811","78496","36","Australian Labor Party (State of Queensland)","60000","2","1","","SA","false"
"CIRCANA (AU) PTY LTD (34 067 719 180)","34067719180","78400","9","Australian Labor Party (Victorian Branch); Australian Labor Party (Victorian Branch) - VIC; Progressive Business Association Inc","218499","5","3","","NSW","false"
"iSentia Pty Ltd","52109382836","77600","10","Australian Labor Party (ALP)","1939468","22","25","","NSW","false"
"Tourism Asset Holdings Ltd","25060896568","77410","12","Australian Labor Party (N.S.W. Branch); Liberal Party of Australia - Federal Secretariat; Liberal Party of Australia (NSW Division); Liberal Party of Australia (NSW) Ryde Forum; Liberal Party of Australia, NSW Division","541901","21","7","","NSW","false"
"Bishopp Outdoor Advertising","55075519121","77000","4","Australian Labor Party (State of Queensland); Liberal National Party of Queensland","26455","1","0","","QLD","false"
"LINFOX PROPRIETARY LIMITED (59 004 667 298)","47004718647","76800","11","Australian Labor Party (N.S.W. Branch); Liberal Party of Australia (Victorian Division); Liberal Party of Australia (Victorian Division) - VIC","123681457","45","1610","Transport","VIC","false"
"Jandakot City Pty Ltd","37126199184","76473","3","National Party of Australia (WA) Inc","1703386","1","22","","WA","false"
"Stambe Enterprises","77001463743","76000","11","Australian Labor Party (N.S.W. Branch); Liberal Party of Australia, NSW Division; Liberal Party of Australia, NSW Division - NSW","150000","1","2","","NSW","false"
"Inter-Chillers Pty Ltd","20003708834","75850","2","Faircloth & Reynolds Pty Ltd","1248610","9","16","","NSW","false"
"Capital Airport Group","52080711191","75778","10","Australian Labor Party (ACT Branch); Australian Labor Party (ALP) - NATIONAL; Australian Labor Party (N.S.W. Branch); The Menzies Research Centre Limited","636027","10","8","","ACT","false"
"MEYER VANDENBERG LAWYERS","21612896992","75600","2","Automotive Food Metals Engineering Printing & Kindred Ind. Union","8396396","43","111","Legal Services","ACT","false"
"Great Union Pty Ltd","67053452387","75394","4","Labor Holdings Pty Ltd","32096","2","0","","VIC","false"
"COMMONWEALTH HILL PROPRIETARY LIMITED","65007544381","74249","15","Liberal Party of Australia; Liberal Party of Australia - NATIONAL; Liberal Party of Australia (S.A. Division); Liberal Party of Australia (S.A. Division) - SA","46060","2","1","","SA","false"
"PRICEWATERHOUSECOOPERS","57097040009","74110","8","Australian Labor Party (State of Queensland); Liberal Party of Australia, NSW Division; Progressive Business Association Inc","14729886","86","199","","ACT","false"
"PET CARE HOLDINGS AUSTRALIA PTY LTD (77 000 060 364)","25000875034","73900","12","Australian Labor Party (State of Queensland); Liberal National Party of Queensland; Liberal Party of Australia - Queensland Division; Liberal Party of Australia - Queensland Division - QLD; Liberal Party of Australia (Victorian Division)","807196821","654","10923","Health","VIC","false"
"Cromarty","56009527226","73870","18","Australian Labor Party (N.S.W. Branch); Australian Labor Party (N.S.W. Branch) - NSW; Australian Labor Party (South Australian Branch); Australian Labor Party (South Australian Branch) - SA; Liberal Party of Australia; Liberal Party of Australia, NSW Division; Shop Distributive & Allied Employees Association - VIC Branch; The 500 Club (VIC)","828638","24","11","","TAS","false"
"MERCEDES-BENZ GROUP AUSTRALIA/PACIFIC PTY LTD (50 004 348 421)","23004411410","73750","15","Australian Labor Party (N.S.W. Branch); Australian Labor Party (N.S.W. Branch) - NSW; Australian Labor Party (Victorian Branch) - VIC; Liberal Party of Australia (Victorian Division); Liberal Party of Australia (Victorian Division) - VIC; Liberal Party of Australia, NSW Division; Liberal Party of Australia, NSW Division - NSW","443511287","1945","6014","","VIC","false"
"HOLDCO HOLDINGS PTY LTD","77065295016","73091","4","National Party of Australia - N.S.W.","64930800","6","888","Transport","VIC","false"
"VILLAGE ROADSHOW THEME PARKS PTY LTD","60010919623","73000","10","Australian Labor Party (State of Queensland)","272445","10","4","agriculture","VIC","false"
"SCREENMAKERS P/L","83001758685","73000","12","ALP - SA; Lib - SA; Lib- SA; Liberal Party of Australia (S.A. Division); Liberal Party of Australia (S.A. Division) - SA","1900946","43","26","","NSW","false"
"AFT PHARMACEUTICALS (AU) PTY LTD","29105636413","72800","11","Australian Labor Party (ALP) - NATIONAL; Australian Labor Party (N.S.W. Branch) - NSW; Australian Labor Party (South Australian Branch); Australian Labor Party (South Australian Branch) - SA; Liberal Party of Australia, NSW Division; Liberal Party of Australia, NSW Division - NSW; The Menzies Research Centre Limited","343565455","23","4719","Health","NSW","false"
"Tritium Pty Ltd","75095500280","72800","14","Australian Labor Party (State of Queensland); Liberal National Party of Queensland","61960","1","1","","QLD","false"
"EUREKA 4WD TRAINING PTY LTD","98150816578","72750","10","Australian Labor Party (VIC Branch); Australian Labor Party (Victorian Branch); Family First Party; Family First Party - NATIONAL; Liberal Party of Australia; Liberal Party of Australia, NSW Division","38700","2","1","transport","WA","false"
"Epson Australia Pty Ltd","91002625783","72600","4","Media Entertainment & Arts Alliance","218314","4","3","Retail","NSW","false"
"CAPEM PTY LIMITED","42008000664","72594","22","Australian Labor Party (South Australian Branch); Liberal Party of Australia (S.A. Division); Liberal Party of Australia (S.A. Division) - SA","11527","1","0","","SA","false"
"TWO10DEGREES PTY LTD","35008576645","72400","11","Australian Labor Party (South Australian Branch); Australian Labor Party (South Australian Branch) - SA; Australian Labor Party (Victorian Branch); Liberal Party of Australia - Tasmanian Division; Liberal Party of Australia (S.A. Division); Liberal Party of Australia (S.A. Division) - SA","1776947","15","25","technology","SA","false"
"The Recruitment Consulting & Staffing Association Limited","41078606416","72000","4","Australian Chamber of Commerce and Industry","7453180","1","104","Education","VIC","false"
"GOVERNMENT SKILLS AUSTRALIA","53115772051","71920","2","Australian Municipal Administrative Clerical and Services Union","106953","3","1","","SA","false"
"REECE AUSTRALIA PTY LTD (84 004 097 090)","84004097090","71650","2","CFMEU Construction and General Division, New South Wales Divisional Branch","4652336","76","65","Construction","VIC","false"
"The Trustee for ARTLU UNIT TRUST","26855078645","71600","14","Australian Labor Party (ALP); Australian Labor Party (State of Queensland)","49379","1","1","","NSW","false"
"KELLOGG BROWN &amp; ROOT PTY LTD &amp; LAING O'ROURKE AUSTRALIA CONSTRUCTION PTY LTD","58351239872","71500","2","Australian Education Union","598746136","16","8374","Construction","NSW","false"
"ORIGIN ENERGY","49108327760","71120","4","Labor Holdings Pty Ltd; Liberal Party of Australia","1149954","5","16","","NSW","false"
"The Royal Australian College Of General Practitioners Ltd","34000223807","70367","17","Australian Labor Party (N.S.W. Branch); Australian Labor Party (Victorian Branch); Liberal Party of Australia; Liberal Party of Australia (Victorian Division); Liberal Party of Australia (Victorian Division) - VIC; Progressive Business Association; Progressive Business Association Inc","9407482","21","134","health","VIC","false"
"MOMENTUM MARKETS PTY LTD","24610789369","70000","4","Liberal Party of Australia, NSW Division","10989","1","0","","NSW","false"
"ST HILLIERS CONSTRUCTION PTY LTD","60082594563","70000","2","CFMEU Construction and General Division, New South Wales Divisional Branch","89584820","4","1280","Construction","NSW","false"
"PTM GROUP PTY LTD","86067318058","70000","4","Australian Labor Party (Northern Territory) Branch; Australian Labor Party (Northern Territory) Branch - NT","19385997","12","277","","NT","false"
"Calvary Health Care Act Limited","74105304989","69990","4","Canberra Labor Club Limited","23116","2","0","Health","NSW","false"
"Clarence Valley Council (85 864 095 684)","85864095684","69906","6","New South Wales Local Government Clerical Administrative Energy Airlines & Utilities Union T/A United Services Union","21740","2","0","","NSW","false"
"SYMBIO HOLDINGS LIMITED","37118699853","69700","10","Australian Labor Party (ALP); Australian Labor Party (N.S.W. Branch); Liberal Party of Australia; Liberal Party of Australia - Queensland Division","40000","1","1","Technology","NSW","false"
"Delta FM Australia Pty Ltd (64 157 852 054)","79114320615","69500","8","Australian Labor Party (ALP)","8981438","4","129","Agriculture","NSW","false"
"THE TRUSTEE FOR SOUTH BRISBANE HOTEL UNIT TRUST","78969118007","68952","2","Automotive Food Metals Engineering Printing & Kindred Ind. Union","279089","7","4","","QLD","false"
"Marand Precision Engineering Pty Ltd","59004763688","68400","6","Australian Labor Party (ALP); Australian Labor Party (State of Queensland); Liberal Party of Australia (Victorian Division)","4190991","13","61","defence","VIC","false"
"QUEENSLAND AMBULANCE SERVICE","89519542578","68328","2","United Workers Union","196500000","3","2876","","QLD","false"
"Lazard Pty Ltd","84086785622","67758","31","Australian Labor Party (ALP); Australian Labor Party (N.S.W. Branch); Australian Labor Party (N.S.W. Branch) - NSW; Australian Labor Party (State of Queensland); Australian Labor Party (Western Australian Branch); Liberal Party of Australia, NSW Division; Liberal Party of Australia, NSW Division - NSW","10765732","17","159","","NSW","false"
"Hewlett Packard Enterprise","74004394763","67260","10","Australian Labor Party (ALP); Australian Labor Party (N.S.W. Branch)","2360769369","2431","35099","Finance","NSW","false"
"IAN THOMAS","58414595621","67200","2","Construction, Forestry, Maritime Employees Union","55500","1","1","","NSW","false"
"DENTSU CREATIVE PTY LTD","85073463966","67138","6","Inverell Power Farm Co; Liberal Party of Australia - Queensland Division - QLD; National Party of Australia (Queensland); National Party of Australia (Queensland) - QLD","4925748","12","73","","VIC","false"
"MaxNetwork Pty Ltd","51067092737","66664","8","Liberal Party of Australia - Queensland Division; Liberal Party of Australia - Queensland Division - QLD; Liberal Party of Australia, NSW Division; Liberal Party of Australia, NSW Division - NSW","1906557029","49","28599","","QLD","false"
"Manpower Services (Australia) Pty Ltd","15071884994","66600","10","Australian Labor Party (ALP); Australian Labor Party (N.S.W. Branch); Liberal Party of Australia, NSW Division","1749685712","212","26272","Agriculture","NSW","false"
"TASMANIAN NETWORKS PTY LTD (24 167 357 299)","24167357299","66000","2","Automotive Food Metals Engineering Printing & Kindred Ind. Union","2059220","14","31","Mining","TAS","false"
"MP Group of Companies","31127705757","66000","2","Australian Labor Party (State of Queensland)","707214","3","11","","NSW","false"
"ASG MELBOURNE PTY LTD","64616840110","66000","4","Liberal National Party of Queensland","189090","3","3","","NSW","false"
"TGI SPORT HOLDINGS PTY LIMITED (79 628 374 210)","79119725469","66000","2","Liberal National Party of Queensland","1212687","13","18","Sport & Recreation","VIC","false"
"CUBIC TRANSPORTATION SYSTEMS (AUSTRALIA) PTY LIMITED","82003617561","66000","6","Australian Labor Party (State of Queensland)","2541000000","6","38500","Transport","NSW","false"
"MG KAILIS PTY LTD","47008684802","65500","13","Australian Democrats, Western Australian Division - WA; Australian Labor Party (Western Australian Branch) - WA; Liberal Party (W.A. Division) Inc. - WA; National Party of Australia - NATIONAL; National Party of Australia (WA) Inc; National Party of Australia (WA) Inc - WA; The 500 Club Inc","2186802","9","33","","WA","false"
"Indue Ltd","97087822464","65354","10","Australian Labor Party (ALP); Australian Labor Party (State of Queensland); United Firefighters Union of SA Inc","50973973","8","780","Finance","QLD","false"
"KALIDONIS PTY LTD","71108969017","65000","4","Australian Labor Party (Northern Territory) Branch","3937873","3","61","","NT","false"
"Ahrens Group Pty Ltd","76114260230","64000","6","Liberal Party of Australia (S.A. Division)","359548","6","6","Construction","SA","false"
"NEXTDC LIMITED","35143582521","63882","2","Labor Holdings Pty Ltd","58935708","27","923","Technology","QLD","false"
"SUEZ WATER PTY LTD (33 051 950 068)","33051950068","63600","10","Australian Labor Party (N.S.W. Branch); Liberal Party of Australia, NSW Division; Liberal Party of Australia, NSW Division - NSW","64771","1","1","Mining","NSW","false"
"WINC AUSTRALIA PTY LIMITED (94 000 728 398)","94000728398","63514","8","Australian Labor Party (State of Queensland)","485497858","854","7644","Retail","NSW","false"
"Four Seasons Hotel Sydney","79121016000","63200","2","Minerals Council of Australia","475725","9","8","","NSW","false"
"Airbnb Australia Pty Ltd","96153841493","63000","4","Australian Labor Party (ALP); Australian Labor Party (State of Queensland); Liberal Party of Australia","357105","2","6","","NSW","false"
"Sensis Pty Ltd","57121852355","62200","10","Australian Labor Party (South Australian Branch); Australian Labor Party (State of Queensland); Australian Labor Party (Victorian Branch); Liberal Party of Australia; Liberal Party of Australia (Victorian Division)","20317","1","0","","","false"
"SERCO AUSTRALIA PTY LTD","36061067436","61224","13","Australian Labor Party (ALP); Liberal Party of Australia - Queensland Division; Liberal Party of Australia - Queensland Division - QLD","18312067","31","299","","NSW","false"
"DEPARTMENT OF CORRECTIVE SERVICES","25103389163","61124","2","Faircloth & Reynolds Pty Ltd","6776895","8","111","","WA","false"
"DORMAKABA AUSTRALIA PTY LTD (14 067 969 466)","14067969466","61000","6","Australian Labor Party (NSW Branch); Liberal Party of Australia (NSW Division); Liberal Party of Australia (Victorian Division); Liberal Party of Australia, NSW Division","3698101","49","61","Construction","VIC","false"
"Macquarie Leisure Operations Ltd","22104529106","61000","7","Australian Labor Party (N.S.W. Branch); Liberal Party of Australia - Tasmanian Division; Liberal Party of Australia, NSW Division; Liberal Party of Australia, NSW Division - NSW","1214958","7","20","","NSW","false"
"Reputation Pty Ltd","57099852810","60800","10","Australian Labor Party (ALP); Liberal Party of Australia (S.A. Division)","215369","4","4","","NSW","false"
"SALMAT LIMITED","11002724638","60780","12","Australian Labor Party (ALP); Liberal Party of Australia (Victorian Division); Liberal Party of Australia, NSW Division; National Party of Australia - N.S.W.","75465","1","1","","NSW","false"
"St Jude Medical Australia Pty Ltd","73080212746","60646","8","Australian Labor Party (ALP); Faircloth & Reynolds Pty Ltd","116083475","26","1914","Health","NSW","false"
"MONDIALE VGL PTY LTD (68 002 433 267)","68002433267","60600","4","Australian Labor Party (N.S.W. Branch); Liberal Party of Australia, NSW Division","39600","1","1","Transport","NSW","false"
"Cenfurn Investments Pty Ltd","13009593480","60000","6","Country Liberal Party (NT); Northern Territory Country Liberal Party; Northern Territory Country Liberal Party - NATIONAL","422219","4","7","","NT","false"
"HOLMWOOD HIGHGATE","15284208388","60000","3","Liberal National Party of Queensland","328988","2","5","","VIC","false"
"TLC Aged Care Pty Ltd","20090724726","60000","2","Liberal Party of Australia (Victorian Division)","76010","1","1","Health","VIC","false"
"Alfred Health (27 318 956 319)","27318956319","60000","2","Australian Nursing & Midwifery Federation","1428163","7","24","Health","VIC","false"
"SOUTH CENTRAL TRUCKS PTY. LTD. (29 007 726 043)","29007726043","60000","7","Australian Labor Party (South Australian Branch); Australian Labor Party (South Australian Branch) - SA; Liberal Party of Australia (S.A. Division)","165880","10","3","Agriculture","SA","false"
"LENDLEASE DEVELOPMENT PTY LIMITED (33 000 311 277)","33000311277","60000","13","Australian Labor Party (N.S.W. Branch) - NSW; Australian Labor Party (State of Queensland); Australian Labor Party (State of Queensland) - QLD; Liberal Party of Australia - Queensland Division - QLD; Liberal Party of Australia (Victorian Division) - VIC; Liberal Party of Australia, NSW Division - NSW","0","2","0","Finance","NSW","false"
"Reveille Strategy Pty Ltd","34606216004","60000","3","Australian Labor Party (State of Queensland)","49500","1","1","","VIC","false"
"Hibiscus Shoppingtown Pty Ltd","48009647518","60000","6","Australian Labor Party (Northern Territory) Branch; Country Liberal Party (NT)","466354","1","8","","NT","false"
"Glad Group Pty Ltd","62092928115","60000","3","ALP-NSW (Rockdale ALP Campaign); Australian Labor Party (N.S.W. Branch)","8391545","4","140","","NSW","false"
"DLA PIPER QUEENSLAND PARTNERSHIP (63 446 756 774)","63446756774","60000","2","Liberal National Party of Queensland","1709140","11","28","","QLD","false"
"HIAB AUSTRALIA PTY LTD","72097663431","60000","4","Christian Democratic Party (Fred Nile Group); Liberal Party of Australia","3364140","57","56","Transport","VIC","false"
"Centre for International Economics","11705723812","59400","2","The Menzies Research Centre Limited","11826393","111","199","","ACT","false"
"University Of Canberra","81633873422","59400","2","Universities Australia","67690990","262","1140","education","ACT","false"
"AUSTRALIAN PUBLIC AFFAIRS LTD","20098705403","58915","14","Australian Labor Party (ALP); Liberal Party of Australia; National Party of Australia; National Party of Australia - N.S.W.","494995","6","8","","NSW","false"
"Group Training Australia Limited","24082751040","58854","14","Australian Labor Party (ALP)","8971392","10","152","Education/Employment","","false"
"Association Of Independent Schools Of The Act Inc","51980437786","58800","14","Australian Labor Party (ALP)","88000","1","1","education","ACT","false"
"John West Logistics Pty Ltd","51095949830","58600","10","Australian Labor Party (South Australian Branch); Australian Labor Party (State of Queensland); Liberal Party of Australia, NSW Division","404800","6","7","","QLD","false"
"LYNCH GROUP HOLDINGS LIMITED (35 608 543 219)","32001695665","58500","12","Australian Labor Party (Western Australian Branch); Australian Labor Party (Western Australian Branch) - WA; Liberal Party (W.A. Division) Inc; Liberal Party (W.A. Division) Inc. - WA","11000","1","0","Agriculture","NSW","false"
"LAVAN LEGAL","47488578158","58000","4","Australian Labor Party (ALP); Liberal Party (W.A. Division) Inc","61490","1","1","Legal Services","WA","false"
"Lennock Motors Pty Limited","25646352527","57800","2","United Workers Union","70365","1","1","","ACT","false"
"Campbell Brothers Limited","92009657489","57550","11","Australian Labor Party - State of Queensland; Australian Labor Party (State of Queensland); Labor Holdings Pty Ltd; Liberal Party of Australia - Queensland Division; Liberal Party of Australia (QLD Division); National Party of Australia (Queensland)","150000","1","3","","QLD","false"
"MBMPL PTY LTD","74099962231","57530","2","National Union of Workers - National Office","29677192","80","516","","NSW","false"
"TERRY WHITE GROUP PTY LTD (64 136 808 243)","38136833620","57500","11","Labor Holdings Pty Ltd; Liberal Party (W.A. Division) Inc. - WA; Liberal Party of Australia - Queensland Division; Liberal Party of Australia, NSW Division","16500","1","0","Health","QLD","false"
"CHARTERED ACCOUNTANTS AUSTRALIA AND NEW ZEALAND","50084642571","56698","14","Australian Labor Party (ALP); Liberal Party of Australia","641149","25","11","Education","NSW","false"
"WORLEY LIMITED","17096090158","56000","12","Australian Labor Party (ALP); Australian Labor Party (Western Australian Branch); Australian Labor Party (Western Australian Branch) - WA; Liberal Party (W.A. Division) Inc; Liberal Party (W.A. Division) Inc. - WA; The 500 Club Inc","165000","1","3","Mining","NSW","false"
"Canberra Data Centres Propriety Ltd","59125710394","55800","10","Australian Labor Party (ALP)","924802555","256","16574","Construction","ACT","false"
"Triforce Australia Pty Ltd","88095104680","55800","10","Australian Democrats NSW Division; Australian Labor Party (N.S.W. Branch); Liberal Party of Australia, NSW Division","10058624","6","180","","NSW","false"
"COMPASS GROUP (AUSTRALIA) PTY LTD","41000683125","55656","4","Construction, Forestry, Maritime Employees Union; Liberal Party of Australia, NSW Division","586471100","162","10537","Agriculture","NSW","false"
"KIAH CONSULTING","20105662735","55335","31","Australian Labor Party (ALP); Australian Labor Party (N.S.W. Branch); Australian Labor Party (N.S.W. Branch) - NSW; Australian Labor Party (South Australian Branch); Australian Labor Party (South Australian Branch) - SA; Australian Labor Party (State of Queensland); Australian Labor Party (State of Queensland) - QLD; Australian Labor Party (Victorian Branch) - VIC","53036057","63","958","","NSW","false"
"BLUNDSTONE AUSTRALIA PTY LTD","60009475852","55258","2","Textiles, Clothing & Footwear Union (Vic & Qld & WA) Branch","28594","1","1","Retail","TAS","false"
"Woden Contractors Pty Ltd","13008581342","55000","20","250 Club Limited; 250 Club Ltd; Liberal Party of Australia - ACT Division; Liberal Party of Australia (ACT Division); Liberal Party of Australia, NSW Division; Liberal Party of Australia, NSW Division - NSW","79886584","11","1452","","NSW","false"
"WORKPAC PTY LTD","23130095135","55000","2","Liberal Party of Australia","601570","7","11","","QLD","false"
"AIR LIQUIDE AUSTRALIA LIMITED (57 004 385 782)","41002653045","55000","2","Communications, Electrical and Plumbing Union - Electrical, Energy and Services Division","64024651","16","1164","Mining","QLD","false"
"JB Hi-Fi Group","53088101268","55000","2","Business Council of Australia","125970","1","2","","VIC","false"
"PETERSEN, PAUL","65848145091","55000","2","Construction, Forestry, Maritime Employees Union","335675","11","6","","ACT","false"
"ATF MINING ELECTRICS PTY LIMITED (91 001 175 435)","91001175435","55000","2","Liberal Party of Australia","2905480","15","53","Mining","NSW","false"
"IMAXEON PTY LTD","93093950906","55000","2","Liberal Party of Australia","2490922","9","45","Agriculture","NSW","false"
"AUSTRALIAN ASSOCIATED PRESS LTD","94641582121","55000","2","Media Entertainment & Arts Alliance","376096","3","7","Education","NSW","false"
