name,abn,donated,donation_count,parties,contract_value,contract_count,contract_per_donation_dollar,sector,state,is_community_controlled
"Bishopp Outdoor Advertising Pty Ltd","62603437958","543652","67","Australian Labor Party (State of Queensland); Australian Labor Party (Victorian Branch); Liberal National Party of Queensland; Liberal Party of Australia (VIC Division); Liberal Party of Australia (Victorian Division)","30092","1","0","","QLD","false"
"Tourism Accommodation Australia","64243628807","543000","8","Australian Labor Party (ALP); Australian Labor Party (Victorian Branch); National Party of Australia - Victoria","22000","1","0","Housing","NSW","false"
"Adco Constructions Pty Ltd","46001044391","542420","22","Australian Labor Party (N.S.W. Branch); CFMEU Construction and General Division, New South Wales Divisional Branch; Construction, Forestry, Maritime Employees Union; Faircloth & Reynolds Pty Ltd; Liberal National Party of Queensland","695982184","16","1283","Construction","NSW","false"
"BGC (AUSTRALIA) PTY LTD","62005736005","541996","61","Australian Labor Party (ALP); Labor Holdings Pty Ltd; Liberal Party (W.A. Division) Inc; Liberal Party of Australia; National Party of Australia; National Party of Australia (WA) Inc; The 500 Club Inc","8736245","2","16","Construction","WA","false"
"WORKERS COMPENSATION NOMINAL INSURER","83564379108","540804","10","Australian Education Union; Australian Nursing & Midwifery Federation; Construction, Forestry, Maritime Employees Union; Electrical Trades Union of Australia NSW Branch; Transport Workers Union of New South Wales","107882","2","0","","NSW","false"
"ISENTIA PTY LIMITED","11002533851","540330","45","Australian Labor Party (ALP); Australian Labor Party (N.S.W. Branch); Australian Labor Party (Victorian Branch); Liberal Party of Australia, NSW Division; Media Entertainment & Arts Alliance; Progressive Business Association Inc","153376389","348","284","","NSW","false"
"CKI UTILITIES DEVELOPMENT LIMITED & Others (13 332 330 749)","13332330749","540000","36","Australian Labor Party (South Australian Branch); Australian Labor Party (South Australian Branch) - SA; Liberal Party of Australia (S.A. Division); Liberal Party of Australia (S.A. Division) - SA","25235621","14","47","Mining","SA","false"
"BAPCOR RETAIL PTY LTD (99 159 177 803)","99159177803","540000","2","United Workers Union","169524","2","0","Retail","VIC","false"
"ABCORP AUSTRALASIA PTY LTD","25072977292","537090","82","Australian Labor Party (Victorian Branch); Australian Labor Party (Victorian Branch) - VIC; Liberal Party of Australia - ACT Division - ACT; Liberal Party of Australia - Queensland Division - QLD; Liberal Party of Australia, NSW Division; Liberal Party of Australia, NSW Division - NSW; National Party of Australia; National Party of Australia - N.S.W.; National Party of Australia - N.S.W. - NSW; National Party of Australia - NATIONAL","28997124","83","54","","VIC","false"
"Southern Cross Austereo Pty Ltd","78109243110","533848","2","United Australia Party","173185","3","0","","VIC","false"
"Diners Club","35004343051","521692","4","Australian Labor Party (N.S.W. Branch); Liberal Party of Australia - ACT Division","14200057","10","27","","NSW","false"
"CV MEDIA &amp; SIGNAGE PTY LTD","34109353595","520940","42","Australian Labor Party (N.S.W. Branch); Australian Labor Party (N.S.W. Branch) - NSW; Australian Labor Party (Northern Territory) Branch - NT; Australian Labor Party (South Australian Branch); Australian Labor Party (State of Queensland); Australian Labor Party (Victorian Branch) - VIC; CFMEU Construction and General Division, New South Wales Divisional Branch; Country Liberal Party (NT); Inverell Power Farm Co; Liberal Party (W.A. Division) Inc; Liberal Party of Australia; Liberal Party of Australia - Queensland Division; Liberal Party of Australia - Queensland Division - QLD; Liberal Party of Australia (Victorian Division) - VIC; Liberal Party of Australia, NSW Division; Liberal Party of Australia, NSW Division - NSW","86056","4","0","construction","QLD","false"
"ARN MEDIA LIMITED","95008637643","520326","27","Australian Labor Party (ALP); Australian Labor Party (N.S.W. Branch); Australian Labor Party (Western Australian Branch); Australian Labor Party (Western Australian Branch) - WA; Labor Holdings Pty Ltd; Liberal Party of Australia (Victorian Division)","13440","1","0","","NSW","false"
"NSW DEPARTMENT OF EDUCATION & TRAINING","40300173822","520184","18","Australian Nursing & Midwifery Federation; CFMEU - Construction & General Division (WA Branch)","358123723","39","688","Education","NSW","false"
"Australian Private Hospitals Association","82008623809","519604","88","Australian Labor Party (ALP); Australian Labor Party (ALP) - NATIONAL; Australian Labor Party (N.S.W. Branch); Australian Labor Party (N.S.W. Branch) - NSW; Liberal Party of Australia; Liberal Party of Australia - ACT Division; Liberal Party of Australia - ACT Division - ACT; Liberal Party of Australia - NATIONAL; Liberal Party of Australia - Tasmanian Division; Liberal Party of Australia - Tasmanian Division - TAS; Liberal Party of Australia (S.A. Division); Liberal Party of Australia (S.A. Division) - SA; Liberal Party of Australia (Victorian Division); Liberal Party of Australia, NSW Division; Liberal Party of Australia, NSW Division - NSW; National Party of Australia; National Party of Australia - N.S.W.","499658","2","1","","ACT","false"
"BILD GROUP PTY LTD (48 645 883 996)","78099996344","518890","12","Liberal Party of Australia (Victorian Division); Liberal Party of Australia, NSW Division; The 500 Club (VIC)","19388796","1","37","Construction","VIC","false"
"COLAS AUSTRALIA GROUP PTY LTD (11 000 388 161)","52001089416","518000","10","Australian Labor Party (N.S.W. Branch); Australian Labor Party (NSW Branch); Liberal Party of Australia; Liberal Party of Australia (Victorian Division); Liberal Party of Australia, NSW Division","9399693","2","18","Construction","NSW","false"
"Union Switch & Signal Pty Ltd","34068707380","517750","23","Australian Labor Party (N.S.W. Branch); Australian Labor Party (N.S.W. Branch) - NSW; Australian Labor Party (State of Queensland) - QLD","2018629","3","4","","WA","false"
"Goodstart Early Learning Ltd","69139967794","517000","10","Australian Labor Party (State of Queensland); The Parenthood Project Limited","330000","1","1","Education","QLD","false"
"Paspaley Pearling Company","67009591708","516050","37","Australian Labor Party (Northern Territory) Branch; Australian Labor Party (Northern Territory) Branch - NT; Australian Labor Party (Western Australian Branch) - WA; CLP Gifts & Legacies Pty Ltd; Country Liberal Party (NT); Country Liberals (Northern Territory); Liberal Party (W.A. Division) Inc; Liberal Party (W.A. Division) Inc. - WA; Liberal Party of Australia - Tasmanian Division; Liberal Party of Australia, NSW Division; National Party of Australia (WA) Inc - WA; NT Country Liberal Party","42240","1","0","","NT","false"
"Perpetual Nominees Limited","37000733700","515676","8","Automotive Food Metals Engineering Printing & Kindred Ind. Union; Labor Campaign Pty Ltd; Liberal National Party of Queensland","8546406","7","17","","NSW","false"
"Macdonald and Michel Lawyers","90137395674","515564","2","Construction, Forestry, Maritime Employees Union","23022","2","0","Legal Services","QLD","false"
"CHEVRON AUSTRALIA DOWNSTREAM FUELS PTY LTD (34 009 644 151)","34009644151","515250","23","Australian Labor Party (Northern Territory) Branch; Australian Labor Party (Northern Territory) Branch - NT; Country Liberal Party (NT); Country Liberals (Northern Territory); Liberal Party of Australia, NSW Division; Northern Territory Country Liberal Party - NATIONAL","101269282","51","197","Mining","QLD","false"
"Chamber of Commerce NT","36160572513","513056","6","Australian Chamber of Commerce and Industry","383072","1","1","","NT","false"
"ELI LILLY AUSTRALIA PTY LIMITED","39000233992","512917","87","ALP; Australian Democrats; Australian Labor Party; Australian Labor Party (ALP); Australian Labor Party (N.S.W. Branch); Liberal Party (W.A. Division) Inc; Liberal Party of Australia; Liberal Party of Australia, NSW Division; Liberal Party of Australia, NSW Division - NSW; National Party of Australia - N.S.W. - NSW","514968","13","1","Health","NSW","false"
"Pacific Dunlop Ltd","89004085330","512872","52","Australian Labor Party - National Secretariat; Australian Labor Party (ALP); Australian Labor Party (N.S.W. Branch); Australian Labor Party (NSW Branch); Australian Labor Party (VIC Branch); Australian Labor Party (Victorian Branch); Liberal Party of Australia; Liberal Party of Australia - Federal Secretariat; Liberal Party of Australia (NSW Division); Liberal Party of Australia (VIC Division); Liberal Party of Australia (Victorian Division); Liberal Party of Australia, NSW Division; National Club Ltd; National Party of Australia; National Party of Australia - National Secretariat; National Party of Australia - Victoria","8536584","16","17","Health","VIC","false"
"OFFICE OF INDUSTRIAL RELATIONS","94496188983","510400","10","Australian Municipal, Administrative, Clerical and Services Union - Queensland (Services and Northern Administrative) Branch","889069","1","2","","QLD","false"
"BAE Systems Applied Intelligence Pty Ltd","12121213803","508200","2","Liberal Party of Australia - ACT Division","275000","1","1","","NSW","false"
"Joondanna Investments","47009596052","500900","30","Australian Labor Party (Northern Territory) Branch; Australian Labor Party (NT); Country Liberal Party (NT); Country Liberals (Northern Territory); Northern Territory Country Liberal Party","9310089","8","19","","NT","false"
"Revesby Workers Club Ltd","34000348121","493940","90","Australian Labor Party (ALP); Australian Labor Party (N.S.W. Branch); Australian Labor Party (N.S.W. Branch) - NSW; Australian Labor Party (NSW Branch)","109989","1","0","","NSW","false"
"NW PEOPLE GROUP PTY LTD","47134737812","492838","10","Australian Labor Party (State of Queensland); Construction, Forestry, Maritime Employees Union; The 500 Club (VIC)","298440","2","1","","NSW","false"
"SAP Australia Pty Ltd","26003682504","486705","18","Australian Labor Party (ALP); Australian Labor Party (State of Queensland); Business Council of Australia; Liberal Party of Australia - Tasmanian Division; The Great Australian Party","5113233694","846","10506","Technology","NSW","false"
"BEILBY DOWNING TEAL PTY LTD (91 097 109 012)","91097109012","482675","26","Australian Labor Party (Western Australian Branch); Liberal Party (W.A. Division) Inc; National Party of Australia (WA) Inc","171986","5","0","","WA","false"
"Australian Government Solicitor (AGS)","69405937639","476314","4","Liberal Party of Australia (Victorian Division); Liberal Party of Australia, NSW Division","1512256138","9089","3175","Legal Services","ACT","false"
"GRP General Roofing Products Pty Ltd","82009616059","476066","26","Australian Labor Party (N.S.W. Branch); Australian Labor Party (State of Queensland); Automotive Food Metals Engineering Printing & Kindred Ind. Union; Liberal Party of Australia; Liberal Party of Australia - Queensland Division - QLD; The Free Enterprise Foundation; United Workers Union","566100","1","1","Construction","NT","false"
"COCKRAM CONSTRUCTION","99004799508","473852","6","CFMEU Construction and General Division, New South Wales Divisional Branch","188525736","9","398","Construction","VIC","false"
"Ultimate Design Graphics Pty Ltd","71110424916","468468","21","Australian Hotels Association; Australian Labor Party (N.S.W. Branch); Australian Labor Party (Tasmanian Branch); Liberal Party (W.A. Division) Inc; Liberal Party of Australia (Victorian Division); Liberal Party of Australia, NSW Division; Shop Distributive & Allied Employees Association - VIC Branch","237211","3","1","","VIC","false"
"Ikea Pty Ltd","84006270757","467474","2","Faircloth & Reynolds Pty Ltd","36078","2","0","Agriculture","NSW","false"
"MHPS PLANT SERVICES PTY LTD","87010975256","465700","24","Australian Labor Party (ALP); Australian Labor Party (N.S.W. Branch); Australian Labor Party (State of Queensland); Australian Labor Party (Western Australian Branch); Liberal Party of Australia; Liberal Party of Australia (Victorian Division); Liberal Party of Australia, NSW Division","745500","1","2","","NSW","false"
"Tasmanian Chamber of Commerce and Industry","77009475987","465650","8","Australian Chamber of Commerce and Industry; Liberal Party of Australia, NSW Division","833144","2","2","","TAS","false"
"ARE MEDIA PTY LIMITED (18 053 273 546)","18053273546","464300","12","Automotive Food Metals Engineering Printing & Kindred Ind. Union","508830","12","1","","NSW","false"
"ONESTEEL TRADING PTY LIMITED","50007519646","464000","30","Australian Labor Party (ALP); Liberal Party of Australia; National Party of Australia - N.S.W.","213255","9","0","","NSW","false"
"Northern Beaches Council","57284295198","462660","26","New South Wales Local Government Clerical Administrative Energy Airlines & Utilities Union T/A United Services Union","77408","4","0","","NSW","false"
"Property Exchange Australia Ltd","92140677792","459860","4","Communications, Electrical and Plumbing Union - Electrical, Energy and Services Division; Mining and Energy Union","103000","2","0","Finance","VIC","false"
"LCN Enterprises","76104048624","459008","4","Construction, Forestry, Maritime Employees Union","14712","1","0","","QLD","false"
"Department of Justice","32790228959","453586","4","Australian Labor Party (ACT Branch); Liberal Party of Australia - ACT Division","3897535","40","9","","","false"
"Vicinity Centres","77007413771","451916","6","Business Council of Australia","5695686","1","13","","VIC","false"
"NEW ZEALAND HOLDINGS PTY LTD","12009382870","450850","4","Australian Council of Trade Unions","51736","4","0","","WA","false"
"SCYNE ADVISORY","20607773295","446200","10","Australian Labor Party (State of Queensland); Business Council of Australia; Liberal Party of Australia - ACT Division","742051546","774","1663","","ACT","false"
"Intuit Australia","28163072704","445694","14","Australian Labor Party (ALP); Laneway Assets Pty Ltd; Laneway Assets Pty Ltd as Trustee for the National Policy Forum Trust","129156","3","0","","NSW","false"
"KIMBERLY-CLARK AUSTRALIA PTY. LIMITED (65 000 032 333)","65000032333","444984","14","CFMEU FFPD Division","443700","1","1","Mining","NSW","false"
"OPTUS Billing Services","95088011536","444396","16","Automotive Food Metals Engineering Printing & Kindred Ind. Union; CFMEU Northern Mining & NSW Energy District; Construction, Forestry, Maritime Employees Union","245066668","356","551","","NSW","false"
"SIRVA RELOCATION PTY LTD (95 098 843 326)","95098843326","443668","2","Coombe Nut Farm","694835","28","2","Transport","VIC","false"
"METAL MANUFACTURES PTY LIMITED (13 003 762 641)","13003762641","442420","10","AWU Port Kembla Branch; National Club Ltd","499971983","410","1130","Construction","NSW","false"
"Melbourne Business School Limited","80007268233","440000","8","Business Council of Australia","76744963","208","174","education","VIC","false"
"Merck Sharp & Dohme (Australia) Pty Ltd","14000173508","439379","129","500 Club of New South Wales Inc; Australian Labor Party (ALP); Australian Labor Party (ALP) - NATIONAL; Australian Labor Party (N.S.W. Branch); Australian Labor Party (N.S.W. Branch) - NSW; Dame Pattie Menzies Foundation Trust; Liberal Party of Australia; Liberal Party of Australia - NATIONAL; Liberal Party of Australia (S.A. Division); Liberal Party of Australia (Victorian Division) - VIC; Liberal Party of Australia, NSW Division; Liberal Party of Australia, NSW Division - NSW; National Party of Australia - N.S.W. - NSW; Progressive Business Association Inc","48420956","73","110","Health","NSW","false"
"NSW GOVERNMENT SCHOOLS","18246198266","434988","4","AEU NSW Teachers Federation; Australian Education Union","9248500","31","21","","NSW","false"
"Dept of Education","63578775294","434384","6","Canberra Labor Club Limited; Construction Forestry Maritime Mining & Energy Union The Construction & General Division ACT Divisional Branch","41678968","109","96","Education","ACT","false"
"PRIXCAR TRANSPORT SERVICES PTY LIMITED","18158361721","433214","2","Transport Workers Union of New South Wales","16500","1","0","","VIC","false"
"WATERCO LIMITED","62002070733","427766","31","Australian Labor Party (State of Queensland); Australian Labor Party (Victorian Branch); Liberal Party of Australia (Victorian Division); Liberal Party of Australia, NSW Division - NSW; Progressive Business Association Inc","38743","1","0","Manufacturing","NSW","false"
"Delta Corporation","67007069794","425998","8","CFMEU - Construction & General Division (WA Branch); Construction, Forestry, Maritime Employees Union","19999811","29","47","Construction","VIC","false"
"Sydney Airports Corporation Limited","62082578809","421880","42","Australian Labor Party (ALP); Australian Labor Party (N.S.W. Branch); Liberal Party of Australia, NSW Division; National Party of Australia - N.S.W.","147593470","39","350","Transport","NSW","false"
"SIEMENS LTD.","98004347880","417400","16","Australian Labor Party (ALP); Australian Labor Party (Victorian Branch); Australian Labor Party (Western Australian Branch); Business Council of Australia; Liberal Party of Australia","60464366","72","145","Mining","VIC","false"
"MERRILL LYNCH (AUSTRALIA) FUTURES LIMITED (34 003 639 674)","34003639674","413700","30","Australian Labor Party - National Secretariat; Australian Labor Party (ALP); Australian Labor Party (ALP) - NATIONAL; Australian Labor Party (VIC Branch); Higgins 200 Club; Liberal Party of Australia - NATIONAL; Liberal Party of Australia (NSW Division); Liberal Party of Australia (Victorian Division); Liberal Party of Australia, NSW Division; Liberal Party of Australia, NSW Division - NSW; The 500 Club (VIC)","1237500","1","3","Finance","NSW","false"
"STRATCO (N.S.W.) PTY. LTD. (30 003 583 702)","30003583702","411994","4","Liberal National Party of Queensland; National Party of Australia (WA) Inc","2072408","2","5","Construction","NSW","false"
"Georgiou Group","82073851948","410668","22","Australian Labor Party (ALP); Liberal Party (W.A. Division) Inc; Perth Trades Hall Inc","438256172","29","1067","Construction","WA","false"
"DAVID JONES PTY LIMITED","75000074573","409132","16","Australian Labor Party (State of Queensland); Labor Holdings Pty Ltd; Liberal Party of Australia - Queensland Division; Shop Distributive and Allied Employees Association (QLD Branch)","17266","2","0","","VIC","false"
"Primary Health Care Limited","33169588096","406700","24","Australian Labor Party (ALP); Australian Labor Party (State of Queensland); Labor Holdings Pty Ltd","47010","1","0","Health","NSW","false"
"HOPGOOGANIM LAWYERS","54105489661","403060","32","Australian Labor Party (State of Queensland); Labor Holdings Pty Ltd; Palmer United Party","740469","7","2","Legal Services","QLD","false"
"CBRE (C) PTY LIMITED (64 003 205 552)","15008912641","401762","30","Australian Labor Party (ALP); CEPU Plumbing Division Victoria; Liberal Party of Australia","3853420","14","10","Finance","QLD","false"
"AM Diagnostics Pty Ltd","36604119360","400000","4","Liberal Party (W.A. Division) Inc","81092000","2","203","","WA","false"
"Merrill Lynch Markets (Australia) Pty Limited","88075587816","396000","4","Business Council of Australia","9817500","3","25","Finance","NSW","false"
"Regus Australia Management Pty Ltd","54127848426","391546","2","CFMEU Construction and General Division, New South Wales Divisional Branch","1739875","20","4","","NSW","false"
"BROTHER INTERNATIONAL (AUST) PTY LTD","17001393835","389651","20","CFMEU Construction and General Division, New South Wales Divisional Branch; Liberal Party of Australia; Liberal Party of Australia, NSW Division; Liberal Party of Australia, NSW Division - NSW","0","1","0","Technology","NSW","false"
"Walkley Foundation Limited","99164809349","388784","12","Media Entertainment & Arts Alliance","41804","1","0","arts","NSW","false"
"Bendigo Kangan Institute (74 802 942 886)","74802942886","388252","2","Australian Education Union","42465509","8","109","Education","VIC","false"
"Highchair Pty Ltd & The Civic Group Holdings Pty Ltd","78729712484","385747","41","Australian Labor Party (ALP); Australian Labor Party (Victorian Branch); Liberal Party of Australia (Victorian Division)","305382","2","1","","VIC","false"
"HEALTHSHARE NSW","65697563521","383690","8","Construction, Forestry, Maritime Employees Union","8581778","8","22","","NSW","false"
"LINK ADMINISTRATION HOLDINGS LIMITED (27 120 964 098)","66009682866","383114","4","Liberal Party of Australia; Queensland Teachers Union","805438","1","2","Finance","NSW","false"
"Honeywell Ltd","18000383764","381300","10","Australian Labor Party (ALP); Liberal Party (W.A. Division) Inc","30438871","162","80","Construction","NSW","false"
"The Registered and Licensed Clubs Association of Queensland, Union of Employers","14544672729","380068","53","Australian Labor Party (State of Queensland); Liberal National Party of Queensland","219480","6","1","","QLD","false"
"ALINTA","92089531984","379722","19","Australian Labor Party (Western Australian Branch); Australian Labor Party (Western Australian Branch) - WA; DB Scott & Co; Liberal Party (W.A. Division) Inc; Liberal Party (W.A. Division) Inc. - WA; National Club Limited; National Party of Australia (WA) Inc - WA","1065153","2","3","","NSW","false"
"Law Council of Australia Limited","85005260622","376876","14","Australian Labor Party (ALP); Canberra Labor Club Limited","200950","9","1","Education","ACT","false"
"Salesforce","47010367576","374000","4","Business Council of Australia","195376363","5","522","","QLD","false"
"Uber","85613635082","374000","4","Business Council of Australia","35000","1","0","","VIC","false"
"Community Broadcasting Association Of Australia Limited","92003108030","374000","2","Construction, Forestry, Maritime Employees Union","423255","2","1","Arts & Culture","NSW","false"
"BRIGHTER SUPER TRUSTEE (94 085 088 484)","94085088484","373874","2","Australian Municipal, Administrative, Clerical and Services Union - Queensland (Services and Northern Administrative) Branch","88229","1","0","Finance","QLD","false"
"DELAWARE NORTH DARWIN CASINO PTY LTD (54 009 624 417)","54009624417","371424","22","Australian Labor Party (Northern Territory) Branch; Australian Labor Party NT; CLP; Country Liberal Party (NT); Northern Territory Country Liberal Party - NATIONAL","299687","7","1","Retail","VIC","false"
"ASX OPERATIONS PTY. LTD. (42 004 523 782)","42004523782","371261","22","Australian Labor Party (ALP); Australian Labor Party (South Australian Branch); Australian Labor Party (Victorian Branch); Construction, Forestry, Maritime Employees Union; Liberal Party of Australia (S.A. Division); Progressive Business Association Inc","2292815","7","6","Finance","NSW","false"
"VIRGIN AUSTRALIA REGIONAL AIRLINES PTY LTD (76 008 997 662)","76008997662","370000","22","Australian Labor Party (ALP); Australian Labor Party (N.S.W. Branch); Australian Labor Party (Victorian Branch); Australian Labor Party (Western Australian Branch); Liberal Party of Australia; Liberal Party of Australia (Victorian Division); Liberal Party of Australia, NSW Division; National Party of Australia (WA) Inc","75294690","5","203","Transport","WA","false"
"AWP AUSTRALIA PTY LTD (52 097 227 177)","52097227177","367944","23","Australian Labor Party (ALP); Construction, Forestry, Maritime Employees Union; Liberal Party of Australia (Victorian Division); Liberal Party of Australia, NSW Division; Liberal Party of Australia, NSW Division - NSW; Universities Australia","101477336","83","276","Finance","QLD","false"
"Medical Technology Association of Australia Limited","61129334354","367857","37","Australian Labor Party (ALP); Australian Labor Party (N.S.W. Branch); Liberal Party of Australia; Liberal Party of Australia - Tasmanian Division; National Party of Australia - N.S.W.","307501","2","1","Health","NSW","false"
"CEVA (AIR AND OCEAN) AUSTRALIA PTY LTD","91055370575","366686","18","Business Council of Australia; Liberal National Party of Queensland; Liberal Party (W.A. Division) Inc; Liberal Party (W.A. Division) Inc. - WA; Liberal Party of Australia (NSW Division); Liberal Party of Australia, NSW Division; Liberal Party of Australia, NSW Division - NSW; The Free Enterprise Foundation; Transport Workers Union of Australia SA/NT Branch","139883","4","0","Transport","NSW","false"
"ADOBE SYSTEMS PTY LTD","72054247835","363000","6","Business Council of Australia; Universities Australia","73172495","31","202","Technology","NSW","false"
"GODFREY HIRST AUSTRALIA PTY LTD","58000849758","362050","44","Australian Labor Party (ALP); Australian Labor Party (ALP) - NATIONAL; Australian Labor Party (VIC Branch); Australian Labor Party (Victorian Branch); Australian Labor Party (Victorian Branch) - VIC; Liberal Party of Australia; Liberal Party of Australia - NATIONAL; Liberal Party of Australia - Queensland Division; Liberal Party of Australia (VIC Division); Liberal Party of Australia (Victorian Division); Liberal Party of Australia (Victorian Division) - VIC","573982","5","2","Retail","VIC","false"
"Canberra Business Chamber Limited","33600390538","360568","6","Australian Chamber of Commerce and Industry","356500","3","1","","ACT","false"
"Australian Security Industries Pty. Limited T/a ASI Locksmiths","53008618899","359530","2","Australian Council of Trade Unions","8238419","109","23","","ACT","false"
