name,abn,donated,donation_count,parties,contract_value,contract_count,contract_per_donation_dollar,sector,state,is_community_controlled
"LENDLEASE CONSTRUCTION (SOUTHERN) PTY LIMITED","56002625130","2449936","371","Australian Labor Party - National Secretariat; Australian Labor Party - State of Queensland; Australian Labor Party (ACT Branch) - ACT; Australian Labor Party (ALP); Australian Labor Party (ALP) - NATIONAL; Australian Labor Party (N.S.W. Branch); Australian Labor Party (N.S.W. Branch) - NSW; Australian Labor Party (Northern Territory) Branch - NT; Australian Labor Party (NSW Branch); Australian Labor Party (SA Branch); Australian Labor Party (South Australian Branch); Australian Labor Party (South Australian Branch) - SA; Australian Labor Party (State of Queensland); Australian Labor Party (State of Queensland) - QLD; Australian Labor Party (VIC Branch); Australian Labor Party (Victorian Branch); Australian Labor Party (Victorian Branch) - VIC; Australian Labor Party (Western Australian Branch); Australian Labor Party (Western Australian Branch) - WA; CFMEU Construction and General Division, New South Wales Divisional Branch; Clarence Campaign (The Hon Craig Knowles); Federal Electorate of Sydney - Sydney FEC; Liberal Party (W.A. Division) Inc; Liberal Party of Australia; Liberal Party of Australia - Federal Secretariat; Liberal Party of Australia - NATIONAL; Liberal Party of Australia - Queensland Division; Liberal Party of Australia - Queensland Division - QLD; Liberal Party of Australia (NSW Division); Liberal Party of Australia (S.A. Division); Liberal Party of Australia (S.A. Division) - SA; Liberal Party of Australia (SA Division); Liberal Party of Australia (VIC Division); Liberal Party of Australia (Victorian Division) - VIC; Liberal Party of Australia, NSW Division; Liberal Party of Australia, NSW Division - NSW; Millennium Forum; National Party of Australia; National Party of Australia - N.S.W.; National Party of Australia - N.S.W. - NSW; National Party of Australia - NATIONAL; National Party of Australia - NSW; National Party of Australia - Victoria; National Party of Australia - Victoria - VIC; National Party of Australia (Queensland); National Party of Australia (Queensland) - QLD; Progressive Business Association; Progressive Business Association Inc; SA Progressive Business Incorporated; The Liberal Party of Western Australia Pty Ltd; Victorian Employers' Chamber of Commerce & Industry","3322310858","38","1356","Finance","NSW","false"
"Memocorp Australia Pty Ltd","57051213800","2435140","198","ALP-NSW; Australian Labor Party (ALP); Australian Labor Party (N.S.W. Branch); Australian Labor Party (N.S.W. Branch) - NSW; Australian Labor Party (NSW Branch); Australian Labor Party (State of Queensland); Australian Labor Party (Victorian Branch); Lib-Fed; LIB-NSW; Liberal National Party of Queensland; Liberal Party of Australia; Liberal Party of Australia - Queensland Division; Liberal Party of Australia - Tasmanian Division; Liberal Party of Australia (NSW Division); Liberal Party of Australia, NSW Division; Liberal Party of Australia, NSW Division - NSW; National Party of Australia - N.S.W.","60228552","11","25","","NSW","false"
"Nikon Australia","34121761537","2367000","20","Media Entertainment & Arts Alliance","2952295","28","1","","NSW","false"
"CSQ","32504484606","2362936","29","Aust Building Const Employees & Builders Labour Fed (QLD Br); CEPU Plumbing Division Queensland Branch; Construction Forestry Mining & Energy, Industrial Union of Employees, Queensland - Construction and General Division; Construction, Forestry, Maritime Employees Union","250000","1","0","","QLD","false"
"Probuild","87148859607","2346434","12","Australian Labor Party (ALP); CFMEU - Construction & General Division (WA Branch); Construction Forestry Mining & Energy, Industrial Union of Employees, Queensland - Construction and General Division; Construction, Forestry, Maritime Employees Union","79927","1","0","","NSW","false"
"VOLVO GROUP AUSTRALIA PTY LTD","27000761259","2338098","92","Automotive Food Metals Engineering Printing & Kindred Ind. Union; Liberal National Party of Queensland","156687684","881","67","Transport","QLD","false"
"CREDIT DATA SOLUTIONS ACQUISITION PTY LTD (37 606 373 675)","72118037317","2321677","82","Australian Labor Party (ALP); Australian Labor Party (ALP) - NATIONAL; Australian Labor Party (N.S.W. Branch); Australian Labor Party (N.S.W. Branch) - NSW; CFMEU Construction and General Division, New South Wales Divisional Branch; Construction, Forestry, Maritime Employees Union; David Pocock; David Pocock - Davi; Forward Brisbane Leadership; Liberal National Party of Queensland; Liberal Party (W.A. Division) Inc.; Liberal Party of Australia; Liberal Party of Australia - NATIONAL; Liberal Party of Australia - Queensland Division - QLD; Liberal Party of Australia (Victorian Division); Liberal Party of Australia, NSW Division; Liberal Party of Australia, NSW Division - NSW; Liberal Properties Limited; National Party of Australia; National Party of Australia - N.S.W.","98560","2","0","","","false"
"The University Of Queensland","63942912684","2315770","14","Universities Australia","346051913","1139","149","education","QLD","false"
"RAYTHEON AUSTRALIA PTY LTD","35063709295","2314650","129","Australian Labor Party (ACT Branch); Australian Labor Party (ACT Branch) - ACT; Australian Labor Party (ALP); Australian Labor Party (South Australian Branch); Australian Labor Party (South Australian Branch) - SA; Australian Labor Party (State of Queensland); Australian Labor Party (Western Australian Branch); Australian Labor Party (Western Australian Branch) - WA; Liberal Party (W.A. Division) Inc; Liberal Party (W.A. Division) Inc. - WA; Liberal Party of Australia; Liberal Party of Australia - NATIONAL; Liberal Party of Australia - Queensland Division; Liberal Party of Australia - Queensland Division - QLD; Liberal Party of Australia (S.A. Division); Liberal Party of Australia (S.A. Division) - SA; Liberal Party of Australia (Victorian Division); Liberal Party of Australia, NSW Division; Liberal Party of Australia, NSW Division - NSW; National Party of Australia; The Menzies Research Centre Limited","5888277158","1664","2544","defence","ACT","false"
"RANDWICK LABOR CLUB","35000353417","2309522","128","Australian Labor Party (ALP); Australian Labor Party (N.S.W. Branch); Australian Labor Party (N.S.W. Branch) - NSW; Australian Labor Party (NSW Branch); Australian Labor Party (WA Branch); Australian Labor Party (Western Australian Branch); Australian Labor Party (Western Australian Branch) - WA; Country Labor Party","10350","1","0","","NSW","false"
"Central Coast Council","88651380372","2308652","64","New South Wales Local Government Clerical Administrative Energy Airlines & Utilities Union T/A United Services Union","60060","2","0","","TAS","false"
"RICHARD CROOKES CONSTRUCTIONS PTY. LIMITED","33001375266","2305350","18","CFMEU Construction and General Division, New South Wales Divisional Branch; Construction, Forestry, Maritime Employees Union; Transport Workers Union of New South Wales","2514944562","31","1091","Construction","NSW","false"
"TURNER FREEMAN LAWYERS","27395824213","2298876","110","Australian Labor Party (N.S.W. Branch); Australian Labor Party (State of Queensland); Automotive Food Metals Engineering Printing & Kindred Ind. Union; Construction, Forestry, Maritime Employees Union","19954","1","0","Legal Services","NSW","false"
"University Of Technology Sydney","77257686961","2291798","40","Australian Labor Party (ALP); Business Council of Australia; Universities Australia","93508656","360","41","education","NSW","false"
"Pitcher Partners","88079569495","2246618","10","Automotive Food Metals Engineering Printing & Kindred Ind. Union; Liberal Party of Australia (Victorian Division)","478023","5","0","","VIC","false"
"Ford Motor Company","67359085508","2237738","70","Automotive Food Metals Engineering Printing & Kindred Ind. Union","121000000","1","54","","WA","false"
"SA Department of Human Services","36342015855","2234390","2","Universities Australia","151482837","98","68","","ACT","false"
"Childers Nominees","93098083526","2213080","2","Canberra Labor Club Limited","2917103","1","1","","ACT","false"
"OFFA PTY LTD","83861139861","2208840","15","Liberal Party (W.A. Division) Inc; Liberal Party (W.A. Division) Inc. - WA; Liberal Party of Australia (WA Division) Inc; The Liberal Party of Western Australia Pty Ltd","1726403","1","1","","WA","false"
"Western Sydney University","53014069881","2206292","22","Australian Labor Party (ALP); Business Council of Australia; Universities Australia","58464179","117","26","education","NSW","false"
"Dept Of Mines and Petroleum","69410335356","2200000","8","Transport Workers Union (WA Branch)","33730995","18","15","","WA","false"
"Deloitte Touche Tohmatsu Limited","41092223240","2190640","110","Australian Labor Party (ALP); Australian Labor Party (N.S.W. Branch); Australian Labor Party (N.S.W. Branch) - NSW; Australian Labor Party (South Australian Branch); Australian Labor Party (South Australian Branch) - SA; Australian Labor Party (State of Queensland) - QLD; Australian Labor Party (Victorian Branch); Australian Labor Party (Victorian Branch) - VIC; Australian Labor Party (Western Australian Branch); Australian Labor Party (Western Australian Branch) - WA; Casey Business Briefing Club; Higgins 200 Club; Liberal Party (W.A. Division) Inc; Liberal Party of Australia - Queensland Division - QLD; Liberal Party of Australia (S.A. Division); Liberal Party of Australia (S.A. Division) - SA; Liberal Party of Australia (Victorian Division); Liberal Party of Australia (Victorian Division) - VIC; Liberal Party of Australia, NSW Division; Liberal Party of Australia, NSW Division - NSW; National Party of Australia - N.S.W. - NSW; National Party of Australia - Victoria - VIC; Progressive Business Association Inc; The 500 Club (VIC); The 500 Club Inc","586134","12","0","","NSW","false"
"Expotas","74894803691","2165588","4","Australian Municipal Administrative Clerical & Services Union - Queensland Together Branch; Australian Municipal Administrative Clerical and Services Union","13921","1","0","","TAS","false"
"Volunteering and Contact ACT Limited","30433789697","2161604","20","Canberra Labor Club Limited","450526","9","0","Community","ACT","false"
"Gwydir Shire Council","11636419850","2150362","2","Roger Moore Pty Ltd","297700","10","0","","NSW","false"
"Clayton UTZ","35740217343","2146249","242","500 Club of New South Wales Inc; Australian Labor Party (ALP); Australian Labor Party (ALP) - NATIONAL; Australian Labor Party (N.S.W. Branch); Australian Labor Party (N.S.W. Branch) - NSW; Australian Labor Party (NSW Branch); Australian Labor Party (State of Queensland); Australian Labor Party (State of Queensland) - QLD; Australian Labor Party (Victorian Branch); Australian Labor Party (Victorian Branch) - VIC; Australian Labor Party (Western Australian Branch); Business Council of Australia; Higgins 200 Club; Liberal National Party of Queensland; Liberal Party (W.A. Division) Inc; Liberal Party of Australia; Liberal Party of Australia - ACT Division; Liberal Party of Australia - ACT Division - ACT; Liberal Party of Australia - Queensland Division; Liberal Party of Australia - Queensland Division - QLD; Liberal Party of Australia (NSW Division); Liberal Party of Australia (QLD Division); Liberal Party of Australia (Victorian Division); Liberal Party of Australia, NSW Division; Liberal Party of Australia, NSW Division - NSW; Liberal Party of Western Australia Pty Ltd; Menzies 200 Club; National Party of Australia - NATIONAL; National Party of Australia (Queensland); National Party of Australia (Queensland) - QLD; Northern Territory Country Liberal Party - NATIONAL; Progressive Business Association; Progressive Business Association Inc; The Brisbane's Future Committee","611183301","2693","285","","NSW","false"
"Wilson Security Pty Ltd","90127406295","2130000","4","United Workers Union","181288364","78","85","","WA","false"
"MMC HOLDINGS (AUSTRALIA) PTY LTD (41 607 891 207)","98002538329","2102610","20","Australian Labor Party (State of Queensland); Bunori Pty Limited; CFMEU - Construction & General Division (WA Branch); Liberal Party of Australia (Victorian Division); Liberal Party of Australia, NSW Division; Progressive Business Association Inc","200000","1","0","finance","","false"
"EMPLOYERS MUTUAL LIMITED","67000006486","2077890","70","Aust Labor Party (SA Branch)/ALP-SA; Australian Council of Trade Unions; Australian Labor Party (ALP); Australian Labor Party (ALP) - NATIONAL; Australian Labor Party (N.S.W. Branch); Australian Labor Party (SA Branch) / ALP-SA; Australian Labor Party (South Australian Branch); Australian Rail Tram & Bus Industry Union New South Wales Branch; CFMMEU - Maritime Union of Australia Division; Construction Forestry Mining & Energy Union SA; Liberal Party of Australia (S.A. Division); Liberal Party of Australia / LIB; Liberal Party of Australia / LIB-NSW; Liberal Party of Australia NSW/LIB-NSW; Liberal Party of Australia, NSW / LIB-NSW; Liberal Party of Australia, NSW Division; Shop, Distributive and Allied Employees Association, South Australia","25500","1","0","Finance","NSW","false"
"LJ Hooker","46890932381","2048490","22","Australian Labor Party (State of Queensland); CEPU Plumbing Division Victoria; Country Liberal Party (NT); Electrical Trades Union of Australia NSW Branch; Health Services Union NSW; Liberal Party of Australia - ACT Division; The Australian Workers' Union of Employees Queensland; United Workers Union","177842","2","0","","VIC","false"
"KG YOUNG & ASSOCIATES PTY LTD","99009596712","2033276","2","CLP Gifts & Legacies Pty Ltd","985999","2","0","","NT","false"
"Jones Lang LaSalle (NSW) Pty Ltd","37002851925","2029338","9","Australian Labor Party (ALP); John McEwen House Pty Ltd; Liberal Party of Australia, NSW Division; Liberal Party of Australia, NSW Division - NSW","536143258","131","264","Finance","NSW","false"
"FLINDERS ADELAIDE CONTAINER TERMINAL PTY LTD (24 004 898 828)","83097377172","2029108","6","Australian Labor Party (South Australian Branch); Construction, Forestry, Maritime Employees Union","129472","4","0","Transport","SA","false"
"PET CARE HOLDINGS AUSTRALIA PTY LTD","77000060364","2014850","108","Australian Labor Party (ALP); Australian Nursing & Midwifery Federation; Liberal Party of Australia; The Menzies Research Centre Limited","231999","3","0","Health","NSW","false"
"SENTINEL PROPERTY GROUP PTY LTD","43149805489","2010816","226","Advance Australia; ALP-QLD; Australian Labor Party (State of Queensland); Labor Holdings Pty Ltd; Liberal National Party of Queensland; Liberal Party of Australia; United Workers Union","995946","1","0","","QLD","false"
"Australian Recording Industry Association","72002692944","2007447","179","Australian Chamber of Commerce and Industry; Australian Democrats - NATIONAL; Australian Labor Party (ALP); Australian Labor Party (ALP) - NATIONAL; Australian Labor Party (N.S.W. Branch); Business Council of Australia; John McEwen House Pty Ltd; Laneway Assets Pty Ltd as Trustee for the National Policy Forum Trust; Liberal Party of Australia; Liberal Party of Australia - NATIONAL; Liberal Party of Australia - Tasmanian Division; Liberal Party of Australia (Victorian Division); Liberal Party of Australia, NSW Division; National Party of Australia; National Party of Australia - NATIONAL","0","4","0","","NSW","false"
"SEEK LIMITED","46080075314","2003692","44","Australian Labor Party (ALP); Australian Labor Party (State of Queensland); Business Council of Australia; Liberal Party of Australia; Liberal Party of Australia (Victorian Division)","2403746","10","1","","VIC","false"
"Master Builders Australia","68137130182","2002783","151","Australian Chamber of Commerce and Industry; Australian Democrats; Australian Labor Party (ALP); Australian Labor Party (N.S.W. Branch); Australian Labor Party (State of Queensland); Liberal National Party of Queensland; Liberal Party (W.A. Division) Inc; Liberal Party of Australia; Liberal Party of Australia - ACT Division; Liberal Party of Australia - Tasmanian Division; Liberal Party of Australia (S.A. Division); Liberal Party of Australia (Victorian Division); Liberal Party of Australia, NSW Division; National Party of Australia","158968","2","0","Construction","ACT","false"
"Empower Masterpay","16099268685","1999180","34","Shop, Distributive and Allied Employees Association, South Australia","4126000","3","2","","VIC","false"
"QBE LENDERS&amp;#x27; MORTGAGE INSURANCE LIMITED (70 000 511 071)","78003191035","1995938","168","Australian Chamber of Commerce and Industry; Australian Education Union; Australian Labor Party (ALP-FED); Australian Labor Party (ALP); Australian Labor Party (N.S.W. Branch); Australian Labor Party (N.S.W. Branch) - NSW; Australian Labor Party (N.S.W. Branch) (ALP-NSW); Australian Labor Party (NSW Branch); Australian Labor Party (South Australian Branch); Australian Labor Party (South Australian Branch) (ALP-SA); Australian Labor Party (Victorian Branch); Australian Labor Party (Western Australian Branch); Automotive Food Metals Engineering Printing & Kindred Ind. Union; Canberra Labor Club Limited; CEPU Plumbing Division Victoria; CFMEU Construction & General Division VIC/TAS Branch; Community and Public Sector Union (PSU Group); Construction, Forestry, Maritime Employees Union; Cormack Foundation Pty Ltd; Country Liberal Party (NT); Liberal National Party of Queensland; Liberal National Party of Queensland (LNP-QLD); Liberal Party (W.A Division) Inc; Liberal Party (W.A Division) Inc. (LIB-WA); Liberal Party (W.A. Division) Inc; Liberal Party of Australia; Liberal Party of Australia - NATIONAL; Liberal Party of Australia - NSW Division; Liberal Party of Australia - NSW Division (LIB-NSW); Liberal Party of Australia - Tasmanian Division; Liberal Party of Australia - Tasmanian Division (LIB-TAS); Liberal Party of Australia (LIB-FED); Liberal Party of Australia (NSW Division); Liberal Party of Australia (Victorian Division); Liberal Party of Australia, NSW Division; Liberal Party of Australia, NSW Division - NSW; Liberal party of Australia, NSW Division (LIB-NSW); Liberal Party of Australia, NSW Division (LIB-NSW); Liberal Pary of Australia - Tasmania Division; Millennium Forum; National Party of Australia; National Party of Australia - N.S.W.; National Party of Australia - NSW; National Party of Australia - Victoria; National Party of Australia (NAT-FED); New South Wales Local Government Clerical Administrative Energy Airlines & Utilities Union T/A United Services Union; Shop Distributive & Allied Employees' Association NSW Branch; Transport Workers Union of Australia SA/NT Branch; Transport Workers Union of New South Wales; United Workers Union","459900693","8","230","Finance","NSW","false"
"Hemmes Trading Pty Ltd","29105332652","1975927","15","Liberal Party of Australia; Liberal Party of Australia, NSW Division","195776","9","0","Agriculture","NSW","false"
"Vicus Commercial Pty Ltd","72107254160","1972728","73","281 Sandgate Road Properties Pty Ltd; A.C.N. 010 507 614 Pty Ltd; Australian Labor Party (ALP); Australian Rail Tram and Bus Industry Union, Western Australia Branch; Liberal National Party of Queensland","24563","1","0","","WA","false"
"COFFEY ENVIRONMENTS PTY LTD","45090522759","1937722","15","Liberal National Party of Queensland; Liberal Party of Australia - Queensland Division; Liberal Party of Australia - Queensland Division - QLD","11482966","12","6","construction","NSW","false"
"Walton Construction","56060900218","1911654","4","A.C.N. 010 507 614 Pty Ltd","2995395","2","2","Construction","QLD","false"
"Medibank Private Ltd","47080890259","1910095","103","Australian Democrats; Australian Labor Party (ALP); Australian Labor Party (ALP) - NATIONAL; Australian Labor Party (State of Queensland); Australian Labor Party (Victorian Branch); Business Council of Australia; Higgins 200 Club; Labor Holdings Pty Ltd; Liberal Party of Australia; Liberal Party of Australia - Queensland Division; Liberal Party of Australia (Victorian Division); Liberal Party of Australia (Victorian Division) - VIC; Progressive Business Association Inc","25887031","20","14","Finance","VIC","false"
"S AJITKUMAR & Others (89 690 832 091)","89690832091","1903756","139","Australia Labor Party - Victoria (ALP-VIC); Australian Chamber of Commerce and Industry; Australian Labor Party - Legacies and Gifts Ltd; Australian Labor Party - Victoria (ALP - VIC); Australian Labor Party - Victoria (ALP-VIC); Australian Labor Party (ALP); Australian Labor Party (ALP) - NATIONAL; Australian Labor Party (N.S.W. Branch); Australian Labor Party (N.S.W. Branch) - NSW; Australian Labor Party (Victorian Branch); Australian Labor Party (Victorian Branch) - VIC; Australian Labor Party (Western Australian Branch); Australian Labor Party (Western Australian Branch) - WA; Business Council of Australia; Liberal Party (W.A. Division) Inc. - WA; Liberal Party of Australia; Liberal Party of Australia - NATIONAL; Liberal Party of Australia (LIB); Liberal Party of Australia (Victorian Division); Liberal Party of Australia (Victorian Division) - VIC; Liberal Party of Australia, NSW Division; Liberal Party of Australia, NSW Division - NSW; Menzies 200 Club; Perth Trades Hall Inc; Progressive Business Association Inc; The 500 Club (VIC)","108536986","984","57","","VIC","false"
"MINTERELLISON (91 556 716 819)","91556716819","1895192","86","ADD LIB; Australian Labor Party (ALP); Australian Labor Party (N.S.W. Branch); Australian Labor Party (Northern Territory) Branch; Australian Labor Party (State of Queensland); Australian Labor Party (Victorian Branch); Australian Labor Party (Western Australian Branch); Business Council of Australia; Higgins 200 Club; Liberal Party (W.A. Division) Inc; Liberal Party of Australia; Liberal Party of Australia - Queensland Division; Liberal Party of Australia (Victorian Division); Liberal Party of Australia, NSW Division; National Party of Australia; Perth Trades Hall Inc; Progressive Business Association Inc; The 500 Club (VIC)","292316322","1260","154","","NSW","false"
"Royal Melbourne Institute Of Technology","49781030034","1894368","16","Universities Australia","97639184","505","52","education","VIC","false"
"Queensland University Of Technology","83791724622","1839060","20","Media Entertainment & Arts Alliance; Universities Australia","74396470","526","40","education","QLD","false"
"ENDEAVOUR ENERGY","59253130878","1821200","44","Automotive Food Metals Engineering Printing & Kindred Ind. Union; Business Council of Australia; Electrical Trades Union of Australia NSW Branch; New South Wales Local Government Clerical Administrative Energy Airlines & Utilities Union T/A United Services Union","235101","2","0","","NSW","false"
"Australian Payments Network","12055136519","1817660","203","ALP-FED; Australian Democrats - NATIONAL; Australian Democrats SA Division - SA; Australian Labor Party (ALP); Australian Labor Party (ALP) - NATIONAL; Australian Labor Party (N.S.W. Branch); Australian Labor Party (State of Queensland); Australian Labor Party (Victorian Branch) - VIC; LIB-FED; LIB-NSW; Liberal Party of Australia; Liberal Party of Australia - NATIONAL; Liberal Party of Australia (S.A. Division) - SA; Liberal Party of Australia (Victorian Division) - VIC; Liberal Party of Australia, NSW Division; Liberal Party of Australia, NSW Division - NSW; National Party of Australia - N.S.W. - NSW; National Party of Australia - NATIONAL; Young National Party of Australia - NATIONAL","184250","4","0","","NSW","false"
"WESTRAC PTY LTD","63009342572","1811036","49","Liberal Party (W.A. Division) Inc; Liberal Party (W.A. Division) Inc. - WA; Minerals Council of Australia; The Australian Workers Union - Newcastle Central Coast & Northern Regions Branch; The Australian Workers' Union NSW Branch","12174005","232","7","","WA","false"
"Access Community Enterprises Limited","79108738629","1781120","42","Automotive Food Metals Engineering Printing & Kindred Ind. Union","830271","2","0","health","QLD","false"
"Corporate Travel Management","17131207611","1776342","38","Australian Labor Party (ALP); Australian Labor Party (N.S.W. Branch); Australian Labor Party (State of Queensland); Liberal Party of Australia, NSW Division; Shop, Distributive & Allied Employees' Association - National","280000","1","0","","QLD","false"
"Transfield Pty Ltd","76000854688","1771425","137","Australian Labor Party (ALP); Australian Labor Party (ALP) - NATIONAL; Australian Labor Party (N.S.W. Branch); Australian Labor Party (N.S.W. Branch) - NSW; Australian Labor Party (State of Queensland); Australian Labor Party (State of Queensland) - QLD; Australian Labor Party (Victorian Branch); Australian Labor Party (Victorian Branch) - VIC; Australian Labor Party (Western Australian Branch); Australian Labor Party / ALP-FED; Construction Forestry Mining & Energy, Industrial Union of Employees, Queensland - Construction and General Division; Liberal Party (W.A. Division) Inc; Liberal Party (W.A. Division) Inc. - WA; Liberal Party of Australia; Liberal Party of Australia - NATIONAL; Liberal Party of Australia (Victorian Division); Liberal Party of Australia, NSW Division; Liberal Party of Australia, NSW Division - NSW; National Party of Australia; National Party of Australia - N.S.W.; National Party of Australia - Victoria; National Party of Australia (Queensland); National Party of Australia (Queensland) - QLD; Richmond FEC; The 500 Club (VIC)","0","1","0","","NSW","false"
"Department of Industry Tourism & Resources","51835430479","1771000","4","Automotive Food Metals Engineering Printing & Kindred Ind. Union","18700","1","0","","ACT","false"
